{
  "schema_version": "1.0.0",
  "manifest_id": "man_2b11c2a0-1b3b-4b7c-8a3a-6b9f7c3d11af",
  "created_at": "2026-03-28T00:30:10Z",
  "producer": { "system": "NOIZY.ai/DreamChamber", "version": "0.1.0", "environment": "dev" },
  "artifact": { "artifact_id": "art_4a2f...", "type": "audio", "title": "Echo: Valley Thunder", "duration_seconds": 18.2, "format": "wav" },
  "integrity": { "payload_sha256": "9f2d...e1", "lineage_hash": "4d1c...aa", "render_locked_before_output": true },
  "rights": {
    "consent_required": true,
    "royalty_rule": "75_25",
    "allowed_uses": ["create", "publish"],
    "blocked_uses": ["nsfw", "political_persuasion", "medical_advice", "sublicense"],
    "revocation_policy_ref": "revocation_v1"
  },
  "attribution": {
    "primary_creator": { "actor_id": "RSP_001", "display_name": "Rob Plowman" },
    "source_contributions": [
      { "contributor_id": "RSP_001", "asset_ref": "voice_dna_rsp001_v1", "consent_token_ref": "token_1b44...", "contribution_type": "origin_voice" },
      { "contributor_id": "VSI_TIMOTHY_CHANG", "asset_ref": "langlib_mandarin_v1", "consent_token_ref": "token_9a12...", "contribution_type": "language_library" }
    ],
    "display_credit_line": "Hybrid voice built from RSP_001 + Timothy Chang (Mandarin library)."
  },
  "links": { "receipt_id": "rcpt_1f8b...", "echo_ids": ["echo_9f5d..."], "memcell_id": "mem_317", "parent_manifest_id": "man_root", "session_id": "sess_dc_0007" },
  "signature": { "algo": "ed25519", "public_key_ref": "noizy_key_01", "signature_b64": "BASE64_SIGNATURE", "signed_canonical_json_sha256": "2aa1...ff" }
}
